{
  "$schema": "https://json-schema.org/draft/2020-12/schema",
  "$id": "evaluation_results.schema.json",
  "title": "evaluation_results.json output contract",
  "type": "object",
  "additionalProperties": false,
  "required": [
    "schema_version",
    "artifact_type",
    "artifact_id",
    "run_id",
    "iteration",
    "producer",
    "mode",
    "created_at",
    "status",
    "input_refs",
    "errors",
    "runtime_metrics",
    "data"
  ],
  "properties": {
    "schema_version": {
      "const": "0.3.0"
    },
    "artifact_type": {
      "const": "evaluation_results"
    },
    "artifact_id": {
      "$ref": "#/$defs/nonEmptyString"
    },
    "run_id": {
      "$ref": "#/$defs/nonEmptyString"
    },
    "iteration": {
      "type": "integer",
      "minimum": 0
    },
    "producer": {
      "const": "reporter"
    },
    "mode": {
      "enum": [
        "diagnosis",
        "development"
      ]
    },
    "created_at": {
      "type": "string",
      "format": "date-time"
    },
    "status": {
      "enum": [
        "completed",
        "partial",
        "failed"
      ]
    },
    "input_refs": {
      "type": "array",
      "items": {
        "$ref": "#/$defs/artifactRef"
      }
    },
    "errors": {
      "type": "array",
      "items": {
        "$ref": "#/$defs/errorItem"
      }
    },
    "runtime_metrics": {
      "oneOf": [
        {
          "$ref": "#/$defs/runtimeMetrics"
        },
        {
          "type": "null"
        }
      ]
    },
    "data": {
      "oneOf": [
        {
          "$ref": "#/$defs/evaluationData"
        },
        {
          "type": "null"
        }
      ]
    }
  },
  "allOf": [
    {
      "$ref": "#/$defs/statusRules"
    }
  ],
  "$defs": {
    "nonEmptyString": {
      "type": "string",
      "minLength": 1
    },
    "sha256": {
      "type": "string",
      "pattern": "^[0-9a-f]{64}$"
    },
    "jsonValue": {
      "oneOf": [
        {
          "type": "null"
        },
        {
          "type": "boolean"
        },
        {
          "type": "number"
        },
        {
          "type": "string"
        },
        {
          "type": "array",
          "items": {
            "$ref": "#/$defs/jsonValue"
          }
        },
        {
          "type": "object",
          "additionalProperties": {
            "$ref": "#/$defs/jsonValue"
          }
        }
      ]
    },
    "artifactRef": {
      "type": "object",
      "additionalProperties": false,
      "required": [
        "artifact_id",
        "artifact_type",
        "iteration",
        "path",
        "sha256"
      ],
      "properties": {
        "artifact_id": {
          "$ref": "#/$defs/nonEmptyString"
        },
        "artifact_type": {
          "$ref": "#/$defs/nonEmptyString"
        },
        "iteration": {
          "type": "integer",
          "minimum": 0
        },
        "path": {
          "$ref": "#/$defs/nonEmptyString"
        },
        "sha256": {
          "$ref": "#/$defs/sha256"
        }
      }
    },
    "evidenceRef": {
      "type": "object",
      "additionalProperties": false,
      "required": [
        "evidence_id",
        "kind",
        "path",
        "sha256",
        "redacted"
      ],
      "properties": {
        "evidence_id": {
          "$ref": "#/$defs/nonEmptyString"
        },
        "kind": {
          "enum": [
            "request",
            "response",
            "dom",
            "screenshot",
            "state",
            "execution_log"
          ]
        },
        "path": {
          "$ref": "#/$defs/nonEmptyString"
        },
        "sha256": {
          "$ref": "#/$defs/sha256"
        },
        "redacted": {
          "type": "boolean"
        }
      }
    },
    "errorItem": {
      "type": "object",
      "additionalProperties": false,
      "required": [
        "code",
        "message",
        "item_ref",
        "retryable"
      ],
      "properties": {
        "code": {
          "$ref": "#/$defs/nonEmptyString"
        },
        "message": {
          "$ref": "#/$defs/nonEmptyString"
        },
        "item_ref": {
          "type": [
            "string",
            "null"
          ]
        },
        "retryable": {
          "type": "boolean"
        }
      }
    },
    "runtimeMetrics": {
      "type": "object",
      "additionalProperties": false,
      "required": [
        "duration_ms",
        "llm_calls",
        "input_tokens",
        "output_tokens",
        "peak_memory_mb"
      ],
      "properties": {
        "duration_ms": {
          "type": [
            "integer",
            "null"
          ],
          "minimum": 0
        },
        "llm_calls": {
          "type": [
            "integer",
            "null"
          ],
          "minimum": 0
        },
        "input_tokens": {
          "type": [
            "integer",
            "null"
          ],
          "minimum": 0
        },
        "output_tokens": {
          "type": [
            "integer",
            "null"
          ],
          "minimum": 0
        },
        "peak_memory_mb": {
          "type": [
            "number",
            "null"
          ],
          "minimum": 0
        }
      }
    },
    "modelInfo": {
      "type": "object",
      "additionalProperties": false,
      "required": [
        "model_id",
        "model_version",
        "prompt_version",
        "temperature",
        "seed"
      ],
      "properties": {
        "model_id": {
          "$ref": "#/$defs/nonEmptyString"
        },
        "model_version": {
          "$ref": "#/$defs/nonEmptyString"
        },
        "prompt_version": {
          "$ref": "#/$defs/nonEmptyString"
        },
        "temperature": {
          "type": [
            "number",
            "null"
          ]
        },
        "seed": {
          "type": [
            "integer",
            "null"
          ]
        }
      }
    },
    "groundTruthRef": {
      "type": "object",
      "additionalProperties": false,
      "required": [
        "dataset_id",
        "dataset_version",
        "path",
        "sha256"
      ],
      "properties": {
        "dataset_id": {
          "$ref": "#/$defs/nonEmptyString"
        },
        "dataset_version": {
          "$ref": "#/$defs/nonEmptyString"
        },
        "path": {
          "$ref": "#/$defs/nonEmptyString"
        },
        "sha256": {
          "$ref": "#/$defs/sha256"
        }
      }
    },
    "metric": {
      "type": "object",
      "additionalProperties": false,
      "required": [
        "metric_id",
        "value",
        "numerator",
        "denominator"
      ],
      "properties": {
        "metric_id": {
          "$ref": "#/$defs/nonEmptyString"
        },
        "value": {
          "oneOf": [
            {
              "type": "number",
              "minimum": 0,
              "maximum": 1
            },
            {
              "type": "null"
            }
          ]
        },
        "numerator": {
          "type": "integer",
          "minimum": 0
        },
        "denominator": {
          "type": "integer",
          "minimum": 0
        }
      }
    },
    "countTriple": {
      "type": "object",
      "additionalProperties": false,
      "required": [
        "tp",
        "fp",
        "fn"
      ],
      "properties": {
        "tp": {
          "type": "integer",
          "minimum": 0
        },
        "fp": {
          "type": "integer",
          "minimum": 0
        },
        "fn": {
          "type": "integer",
          "minimum": 0
        }
      }
    },
    "unverifiedCounts": {
      "type": "object",
      "additionalProperties": false,
      "required": [
        "policy_blocked",
        "approval_pending",
        "indeterminate"
      ],
      "properties": {
        "policy_blocked": {
          "type": "integer",
          "minimum": 0
        },
        "approval_pending": {
          "type": "integer",
          "minimum": 0
        },
        "indeterminate": {
          "type": "integer",
          "minimum": 0
        }
      }
    },
    "evaluationData": {
      "type": "object",
      "additionalProperties": false,
      "required": [
        "ground_truth_ref",
        "source_graph_revision",
        "matching_profile",
        "metrics",
        "candidate_counts",
        "confirmed_counts",
        "unverified_counts",
        "models",
        "run_metrics",
        "notes"
      ],
      "properties": {
        "ground_truth_ref": {
          "$ref": "#/$defs/groundTruthRef"
        },
        "source_graph_revision": {
          "type": "integer",
          "minimum": 0
        },
        "matching_profile": {
          "$ref": "#/$defs/nonEmptyString"
        },
        "metrics": {
          "type": "array",
          "items": {
            "$ref": "#/$defs/metric"
          }
        },
        "candidate_counts": {
          "$ref": "#/$defs/countTriple"
        },
        "confirmed_counts": {
          "$ref": "#/$defs/countTriple"
        },
        "unverified_counts": {
          "$ref": "#/$defs/unverifiedCounts"
        },
        "models": {
          "type": "object",
          "additionalProperties": {
            "$ref": "#/$defs/modelInfo"
          }
        },
        "run_metrics": {
          "$ref": "#/$defs/runtimeMetrics"
        },
        "notes": {
          "type": "array",
          "items": {
            "type": "string"
          }
        }
      }
    },
    "statusRules": {
      "allOf": [
        {
          "if": {
            "properties": {
              "status": {
                "const": "completed"
              }
            }
          },
          "then": {
            "properties": {
              "errors": {
                "maxItems": 0
              },
              "data": {
                "$ref": "#/$defs/evaluationData"
              }
            }
          }
        },
        {
          "if": {
            "properties": {
              "status": {
                "const": "partial"
              }
            }
          },
          "then": {
            "properties": {
              "errors": {
                "minItems": 1
              },
              "data": {
                "$ref": "#/$defs/evaluationData"
              }
            }
          }
        },
        {
          "if": {
            "properties": {
              "status": {
                "const": "failed"
              }
            }
          },
          "then": {
            "properties": {
              "errors": {
                "minItems": 1
              },
              "data": {
                "type": "null"
              }
            }
          }
        }
      ]
    }
  }
}
